Test Name,Year,Session,Subject,Number,Question,Question_image,Option 1,Option 2,Option 3,Option 4,Answer
산업안전기사,2008,1,화학설비위험방지기술,82,다음 중 방폭기기에 반드시 설치하여야 할 것은?,,용기 내측 또는 주위에 냉각을 위한 물의 순환 통로,용기 내측의 접속단자 근처의 접지단자,마찰을 줄이기 위한 기름의 순환 통로,용기 내측과 외부와의 공기 순환 통로,2
산업안전기사,2008,1,화학설비위험방지기술,83,산업안전기준에 관한 규칙에서 안전밸브 등의 전 후단에 자물쇠형 또는 이에 준한 형식의 차단밸브를 설치할 수 있는 경우가 아닌 것은?,,화학설비 및 그 부속설비에 안전밸브 등이 복수방식으로 설치되어 있는 경우,인접한 화학설비 및 그 부속설비에 안전밸브 등이 각각 설치되어 있고 해당 화학설비 및 그 부속설비의 연결배관에 차단밸브가 없는 경우,파열판과 안전밸브를 직렬로 설치하는 경우,열팽창에 의하여 상승된 압력을 낮추기 위한 목적으로 안전밸브가 설치된 경우,3
산업안전기사,2008,1,화학설비위험방지기술,84,"산업안전보건법에서 규정한 독성물질은 쥐에 대한 4시간 동안은 흡입시험에 의하여 실험동물 50%를 사망시킬 수 있는 농도, 즉 $LC_{50}$이 몇 ppm 이하인 물질을 말하는가?",,1000,2500,3000,4000,2
산업안전기사,2008,1,화학설비위험방지기술,85,다음 연소이론에 대한 설명으로 틀린 것은?,,착화온도가 낮을수록 연소위험이 크다.,인화점이 낮은 물질은 반드시 착화점도 낮다.,인화점이 낮을수록 일반적으로 연소위험도 크다.,연소범위가 넓을수록 연소위험이 크다.,2
산업안전기사,2008,1,화학설비위험방지기술,86,다음 중 산업안전보건법에서 규정한 위험물질의 종류와 해당 물질의 연결이 잘못된 것은?,,"물반응성 물질 및 인화성 고체: 칼륨, 황",폭발성 물질 및 유기과산화물 : 질산에스테르류,인화성 가스 : 염소산 및 그 염류,산화성 액체 및 산화성 고체 : 과산화수소 및 무기과산화물,3
산업안전기사,2008,1,화학설비위험방지기술,87,다음 중 열교환기의 보수에 있어서 일상정검항목으로볼 수 없는 것은?,,보온재 및 보냉재의 파손상황,부식의 형태 및 정도,도장의 노후상황,flange부 등의 외부 누출여부,2
산업안전기사,2008,1,화학설비위험방지기술,88,다음 중 물질의 자연발화를 촉진시키는데 영향을 가장 적게 미치는 것은?,,"표면적이 넓고, 발열량이 클 것",열전도율이 클 것,주위 온도가 높을 것,적당한 수분을 보유할 것,2
산업안전기사,2008,1,화학설비위험방지기술,89,"활성화에너지 E가 대체적으로 같은 값을 가지는 인화성 기체의 폭발하한계(X)와 연소열(Q) 사이에는 어떠한 근사적인 관계가 성립하는가?(단, n은 정수이다.)",,$X \cdot Q \cong \text{const}$,$X/Q \cong \text{const}$,$(Q/X)^n = \text{const}$,$Q/X + 2^n = \text{const}$,1
산업안전기사,2008,1,화학설비위험방지기술,90,다음 중 상온에서 물과 격렬히 반응하여 수소를 발생시키는 물질은?,,Ti,K,Fe,Ag,2
산업안전기사,2008,1,화학설비위험방지기술,91,다음 중 화학공장에서 주로 사용되는 불활성 가스는?,,수소,수증기,질소,일산화탄소,3
산업안전기사,2008,1,화학설비위험방지기술,92,다음 중 산업안전보건법상 화학설비의 부속설비로만 이루어진 것은?,,"사이클론, 백필터, 전기집진기 등의 분진처리설비","응축기, 냉각기, 가열기, 증발기 등의 열교환기류",고로 등 정화기를 직접 사용하는 열교환기류,"혼합기, 발포기, 압출기 등의 화학제품 가공설비",1
산업안전기사,2008,1,화학설비위험방지기술,93,다음 중 산화성 물질의 저장·취급에 있어서 고려하여야 할 사항과 가장 거리가 먼 것은?,,가열·충격· 마찰 등 분해를 일으키는 조건을 주지말 것,분해를 촉진하는 약품류와 접촉을 피할 것,내용물이 누출되지 않도록 할 것,습한 곳에 밀폐하여 저장할 것,4
산업안전기사,2008,1,화학설비위험방지기술,94,다음 중 유류화재와 전기화재에 모두 사용할 수 있는 소화기로 가장 적당한 것은?,,산·알칼리소화기,분말소화기,포말소화기,물소화기,2
산업안전기사,2008,1,화학설비위험방지기술,95,다음 중 축류식 압축기에 대한 설명으로 옳은 것은?,,casing 내에 1개 또는 수 개의 특수피스톤을 설치하여 이것을 회전시킬 때 casing과 피스톤 사이의 체적이 감소해서 기체를 압축하는 방식이다.,실린더 내에서 피스톤을 왕복시켜 이것에 따라 개폐하는 흡입밸브 및 배기밸브의 작용에 의해 기체를 압축하는 방식이다.,casing 내에 넣어진 날개바퀴를 회전시켜 기체에 작용하는 원심력에 의해서 기체를 압송하는 방식이다.,프로펠러의 회전에 의한 추진력에 의해 기체를 압송하는 방식이다.,4
산업안전기사,2008,1,화학설비위험방지기술,96,포소화약제 혼합장치로서 정하여진 농도로 물과 혼합하여 거품 수용액을 만드는 장치가 아닌 것은?,,관로혼입장치,차압혼합장치,펌프혼합장치,낙하혼합장치,4
산업안전기사,2008,1,화학설비위험방지기술,97,다음 가스 중 독성가스에 속하지 않는 것은?,,암모니아,황화수소,포스겐,질소,4
산업안전기사,2008,1,화학설비위험방지기술,98,산업안전보건법에 따라 사업주가 특수화학설비를 설치하는 때에 그 내부의 이상상태를 조기에 파악하기 위하여 설치하여야 하는 장치는?,,자동경보장치,안전감시장치,자동문개폐장치,스크러버개방장치,1
산업안전기사,2008,1,화학설비위험방지기술,99,다음 관(pipe) 부속품 중 관로의 방향을 변경하기 위하여 사용하는 부속품은?,,플랜지(flange),유니온(union),니플(nipple),엘보우(elbow),4
산업안전기사,2008,1,화학설비위험방지기술,100,프로판의 폭발한계가 2.2 ~ 9.5vol% 일 때 위험도는 약 얼마인가?,,2.52,3.32,4.91,5.64,2
산업안전기사,2008,1,건설안전기술,101,다음 기계 중 양중기에 포함되지 않는 것은?,,리프트,곤돌라,크레인,클램셸,4
산업안전기사,2008,1,건설안전기술,102,"강관비계의 종류 중 단관비계를 설치할 때 조립간격으로 옳은 것은? (단, 수직방향 수평방향의 순서임)",,"4m, 4m","5m, 5m","5.5m, 7.5m","6m, 8m",2
산업안전기사,2008,1,건설안전기술,103,30° 경사각의 가설통로에서 미끄럼막이 간격으로 알맞은 것은?,,30cm,40cm,50cm,60cm,1
산업안전기사,2008,1,건설안전기술,104,양중기에 사용해서는 안되는 와이어로프에 대한 설명으로 잘못된 것은?,,이음매가 있는 것,지름의 감소가 공칭지름의 7%를 초과하는 것,심하게 변형 또는 부식된 것,와이어로프의 한 꼬임에서 끊어진 소선의 수가 5%이상인것,4
산업안전기사,2008,1,건설안전기술,105,운반작업시 주의사항으로 옳지 않은 것은?,,단독으로 긴 물건을 어깨에 메고 운반할 때에는 뒤쪽을 위로 올린 상태로 운반한다.,운반시의 시선은 진행방향을 향하고 뒷걸음 운반을 하여서는 안된다.,무거운 물건을 운반할 때 무게 중심이 높은 하물은 인력으로 운반하지 않는다.,물건을 들고 일어날 때는 허리보다 무릎의 힘으로 일어선다.,1
산업안전기사,2008,1,건설안전기술,106,가설통로를 설치할 때 준수하여야 할 사항에 관한 설명으로 잘못된 것은?,,건설공사에 사용하는 높이 8m 이상의 비계다리에는 7m 이내마다 계단참을 설치한다.,경사가 15°를 초과하는 때에는 미끄러지지 않는 구조로 한다.,추락의 위험이 있는 곳에는 안전난간을 설치한다.,수직갱에 가설된 통로의 길이가 10m 이상인 때 에는 8m 이내마다 계단참을 설치한다.,4
산업안전기사,2008,1,건설안전기술,107,지게차 운전시의 안전사항에 해당되지 않는 것은?,,"짐을 들어올린 상태로 출발, 주행하여야 한다.",적재하물이 크고 현저하게 시계를 방해할 때에는 유도자를 붙여 차를 유도시키는 등의 조치를 취해야한다.,짐을 싣고 내리막 길을 내려갈 때는 전진으로 천천히 운행할 것,철판 또는 강목을 다리 대용으로 하여 통과할 때는 반드시 강도를 확인할 것,3
산업안전기사,2008,1,건설안전기술,108,흙막이공의 파괴원인 중 보일링 현상이 주된 원인이 되는 경우가 있다. 보일링 현상에 관한 설명으로 틀린 것은?,,지하수위가 높은 지반을 굴착할 때 주로 발생한다.,연약 사질토 지반에서 주로 발생한다.,시트파일(sheet pile) 등의 저면에 분사현상이 발생한다.,연약 점토지반에서 굴착면의 융기로 발생한다.,4
산업안전기사,2008,1,건설안전기술,109,이동식 크레인 작업시 준수해야 할 사항으로 잘못된 것은?,,운전사는 반드시 면허를 받은 자이어야 한다.,전력선 근처에서의 작업시 붐과 전력선과의 거리는 최소 1m 이상 간격을 유지한다.,부득이한 경우 전용 탑승설비를 설치하여 근로자를 탑승시킬 수 있다.,제한된 지브의 경사각 범위에서만 작업을 해야 한다.,2
산업안전기사,2008,1,건설안전기술,110,흙막이 말뚝에 대한 지하수 재해방지상 유의하여야 할점으로 틀린 것은?,,"토압, 수압, 적재하중 등에 대하여 계획과 시공 중 관찰 측정한 결과를 비교 검토한다.",흙막이 말뚝의 근입길이를 짧게 하여 히빙 및 보일링현상을 방지한다.,"지하수, 복류수 등의 상황을 고려하여 충분한 지수 효과를 갖도록 조치한다.","누수, 출수 등을 조기 발견할 수 있도록 해야 하며, 누수, 출수의 우려가 있을 경우에는 적절한 조치를 취한다.",2
산업안전기사,2008,1,건설안전기술,111,추락의 위험이 있는 개구부에 대한 방호조치로서 적합하지 않은 것은?,,안전난간울 및 손잡이 등으로 방호조치 한다.,충분한 강도를 가진 구조의 덮개를 뒤집히거나 떨어지지 않도록 설치한다.,어두운 장소에서도 식별이 가능한 개구부 주의표지를 부착한다.,폭 30cm 이상의 발판을 설치한다.,4
산업안전기사,2008,1,건설안전기술,112,통나무비계를 조립할 때 준수하여야 할 사항에 대한 아래 표의 내용에서 ()에 가장 적합한 것은? 비계기둥의 이음이 맞댄이음인 때에는 비계기둥을 쌍기둥틀로 하거나 ( ① )미터 이상의 덧댐목을 사용하며 ( ② )개소 이상을 묶을 것,,"①: 1.0, ②: 4","①: 1.8, ②: 4","①: 1.0, ②: 2","①: 1.8, ②: 2",2
산업안전기사,2008,1,건설안전기술,113,화물을 차량계 하역운반기계에 적재 또는 적하시 작업 지휘자를 지정하여야 하는 기준에 대해 옳은 것은?,,단위화물의 무게가 250kg 이상일 때,단위화물의 무게가 200kg 이상일 때,단위화물의 무게가 150kg 이상일 때,단위화물의 무게가 100kg 이상일 때,4
산업안전기사,2008,1,건설안전기술,114,토석붕괴의 외적 원인으로 옳지 않은 것은?,,"사면, 법면의 경사 및 기울기의 증가",절토 및 성토 높이의 증가,토사 및 암석의 혼합층 두께,토석의 강도 저하,4
산업안전기사,2008,1,건설안전기술,115,콘크리트 측압에 관한 설명으로 옳은 것은?,,부어 넣기 속도가 빠르면 측압은 작아진다.,철근의 양이 적으면 측압은 작아진다.,대기의 온도가 낮을수록 측압은 크다.,구조물의 단면이 크면 측압은 작다.,3
산업안전기사,2008,1,건설안전기술,116,산업안전보건법령에 따라 사다리식 통로를 설치하는 경우 준수하여야 하는 사항으로 틀린 것은?,,"재료는 심한 손상, 부식 등이 없는 것으로 할 것",폭은 30센티미터 이상으로 할 것,발판의 간격은 동일하게 할 것,사다리 기둥과 수평면과의 각도는 85도 이하로 할 것,4
산업안전기사,2008,1,건설안전기술,117,철륜 표면에 다수의 돌기를 붙여 접지면적을 작게 하여 접지압을 증가시킨 롤러로서 고함수비의 점성토지반의 다짐 작업에 적합한 롤러는?,,탠덤롤러,로드롤러,타이어롤러,탬핑롤러,4
산업안전기사,2008,1,건설안전기술,118,굴착시 토석붕괴 방지공법에 대한 설명 중 틀린 것은?,,활동할 가능성이 있는 토석은 제거해야 한다.,비탈면 하단을 다져서 활동이 되지 않도록 한다.,비탈면 상단에 다짐 또는 하중을 재하한다.,말뚝을 박아 토석 붕괴를 방지한다.,3
산업안전기사,2008,1,건설안전기술,119,차량계 건설기계를 사용하여 작업하고자 할 때 작업계획서에 포함되어야 할 사항으로 적합하지 않은 것은?,,사용하는 차량계 건설기계의 종류 및 성능,차량계 건설기계의 운행경로,차량계 건설기계에 의한 작업방법,차량계 건설기계의 유지보수방법,4
산업안전기사,2008,1,건설안전기술,120,항타기 또는 항발기의 권상장치의 드럼축과 권상장치로부터 첫 번째 도르래의 축과의 거리는 권상장치의 드럼폭의 최소 몇 배 이상으로 해야 하는가?,,5배,10배,15배,20배,3
